term;explanation;source
Видеоуроки; А когда будут добавлены видеоуроки?;user
Впечатления;Очень красивый сайт!;mashapetrova
Исторические справки;Здравствуйте! Не могли бы вы добавить ещё немного исторических справок? Информация интересная, но хотелось бы почитать больше об ацтеках.;Вася Пупкин
О словарях;Здравствуйте! Хотелось бы уточнить, планируется ли введение словаря юкатекского, пурепеча и прочих языков? Буду рад услышать обратную связь!;user
Первый русскоязычный?;Вы действительно уверены, что этот сайт - точно первый русскоязычный портал такого рода? Мне казалось, что за столько лет кто-то должен был бы уже организовать подобный архив...;sidorov1998